24 07,program,ბაქო–თბილისი–ყარსის სარკინიგზო მაგისტრალის მშენებლობისათვის მარაბდა–ახალქალაქი–კარწახის მონაკვეთზე კერძო საკუთრებაში არსებული მიწების გამოსყიდვა კომპენსაცია,საფრანგეთის სასაქონლო დახმარება (Government of France),ბაქო–თბილისი–ყარსის სარკინიგზო მაგისტრალის მშენებლობისათვის მარაბდა–ახალქალაქი–კარწახის მონაკვეთზე კერძო საკუთრებაში არსებული მიწების გამოსყიდვა-კომპენსაცია,ბაქო - თბილისი - ყარსის სარკინიგზო მაგისტრალის მშენებლობისათვის მარაბდა - ახალქალაქი - კარწახის მონაკვეთზე კერძო საკუთრებაში არსებული მიწების გამოსყიდვა- კომპენსაცია,ბაქო - თბილისი - ყარსის სარკინიგზო მაგისტრალის მშენებლობისათვის მარაბდა - ახალქალაქი - კარწახის მონაკვეთზე კერძო საკუთრებაში არსებული მიწების გამოსყიდვა- კომპენსაცია,false
24 08,program,საქართველოს მიერ საერთაშორისო ხელშეკრულებებით ნაკისრი ვალდებულებების ფარგლებში საქართველოს აეროპორტებში საჰაერო ხომალდების აფრენა დაფრენისათვის საჭირო მომსახურების ხარჯების ანაზღაურება მათ შორის წინა წლებში წარმოქმნილი დავალიანებების დაფარვა,სათხილამურო ინფრასტრუქტურის განვითარება ზემო სვანეთში (Government of France),,სამეცნიერო კვლევების ხელშეწყობა,ინოვაციური ეკოსისტემის განვითარება (IBRD),false
24 09,program,საფრანგეთის სასაქონლო დახმარება საფრანგეთი,ბაქო-თბილისი-ყარსის სარკინიგზო მაგისტრალის მშენებლობისათვის მარაბდა-ახალქალაქი-კარწახის მონაკვეთზე კერძო საკუთრებაში არსებული მიწების გამოსყიდვა კომპენსაცია,,,,false
24 10,program,სათხილამურო ინფრასტრუქტურის განვითარება ზემო სვანეთში (Government of the French Republic),,,სსიპ - სასწავლო უნივერსიტეტი - ბათუმის სახელმწიფო საზღვაო აკადემია,სსიპ - სასწავლო უნივერსიტეტი - ბათუმის სახელმწიფო საზღვაო აკადემია,false
25 00,spending agency,საქართველოს რეგიონული განვითარებისა და ინფრასტრუქტურის სამინისტრო,საქართველოს რეგიონული განვითარებისა და ინფრასტრუქტურის სამინისტრო,საქართველოს რეგიონული განვითარებისა და ინფრასტრუქტურის სამინისტრო,საქართველოს რეგიონული განვითარებისა და ინფრასტრუქტურის სამინისტრო,საქართველოს რეგიონული განვითარებისა და ინფრასტრუქტურის სამინისტრო,true
25 01,program,რეგიონებისა და ინფრასტრუქტურის განვითარების პოლიტიკის შემუშავება და მართვა,რეგიონებისა და ინფრასტრუქტურის განვითარების პოლიტიკის შემუშავება და მართვა,რეგიონებისა და ინფრასტრუქტურის განვითარების პოლიტიკის შემუშავება და მართვა,რეგიონებისა და ინფრასტრუქტურის განვითარების პოლიტიკის შემუშავება და მართვა,რეგიონებისა და ინფრასტრუქტურის განვითარების პოლიტიკის შემუშავება და მართვა,true
25 02,program,საგზაო ინფრასტრუქტურის გაუმჯობესების ღონისძიებები,საგზაო ინფრასტრუქტურის გაუმჯობესების ღონისძიებები,საგზაო ინფრასტრუქტურის გაუმჯობესების ღონისძიებები,საგზაო ინფრასტრუქტურის გაუმჯობესების ღონისძიებები,საგზაო ინფრასტრუქტურის გაუმჯობესების ღონისძიებები,true
25 02 01,sub-program,საავტომობილო გზების პროგრამების მართვა,საავტომობილო გზების პროგრამების მართვა,საავტომობილო გზების პროგრამების მართვა,საავტომობილო გზების პროგრამების მართვა,საავტომობილო გზების პროგრამების მართვა,true
25 02 02,sub-program,გზების მშენებლობა და მოვლა შენახვა,გზების მშენებლობა და მოვლა შენახვა,გზების მშენებლობა და მოვლა-შენახვა,გზების მშენებლობა და მოვლა-შენახვა,გზების მშენებლობა და მოვლა-შენახვა,false
25 02 03,sub-program,ჩქაროსნული ავტომაგისტრალების მშენებლობა,ჩქაროსნული ავტომაგისტრალების მშენებლობა,ჩქაროსნული ავტომაგისტრალების მშენებლობა,ჩქაროსნული ავტომაგისტრალების მშენებლობა,ჩქაროსნული ავტომაგისტრალების მშენებლობა,true
25 03,program,რეგიონული და მუნიციპალური ინფრასტრუქტურის რეაბილიტაცია,რეგიონული და მუნიციპალური ინფრასტრუქტურის რეაბილიტაცია,რეგიონული და მუნიციპალური ინფრასტრუქტურის რეაბილიტაცია,რეგიონული და მუნიციპალური ინფრასტრუქტურის რეაბილიტაცია,რეგიონული და მუნიციპალური ინფრასტრუქტურის რეაბილიტაცია,true
25 04,program,წყალმომარაგების ინფრასტრუქტურის აღდგენა რეაბილიტაცია,წყალმომარაგების ინფრასტრუქტურის აღდგენა რეაბილიტაცია,წყალმომარაგების ინფრასტრუქტურის აღდგენა-რეაბილიტაცია,წყალმომარაგების ინფრასტრუქტურის აღდგენა-რეაბილიტაცია,წყალმომარაგების ინფრასტრუქტურის აღდგენა-რეაბილიტაცია,false
25 05,program,იძულებით გადაადგილებული პირების მხარდაჭერა,იძულებით გადაადგილებული პირების მხარდაჭერა,იძულებით გადაადგილებული პირების მხარდაჭერა,იძულებით გადაადგილებული პირების მხარდაჭერა,იძულებით გადაადგილებული პირების მხარდაჭერა,true
25 06,program,კახეთის განვითარების პროექტი,,,,,true
26 00,spending agency,საქართველოს იუსტიციის სამინისტრო,საქართველოს იუსტიციის სამინისტრო,საქართველოს იუსტიციის სამინისტრო,საქართველოს იუსტიციის სამინისტრო,საქართველოს იუსტიციის სამინისტრო,true
26 01,program,სამართალშემოქმედებისა და ქვეყნის ინტერესების სამართლებრივი მხარდაჭერის მიზნით სახელმწიფო პოლიტიკის შემუშავება და მართვა,სამართალშემოქმედებისა და ქვეყნის ინტერესების სამართლებრივი მხარდაჭერის მიზნით სახელმწიფო პოლიტიკის შემუშავება და მართვა,"სამართალშემოქმედებისა და ქვეყნის ინტერესების სამართლებრივი მხარდაჭერის მიზნით სახელმწიფო პოლიტიკის შემუშავება და მართვა, მათ შორის, სისხლის სამართლის სისტემის რეფორმის განხორციელება","სამართალშემოქმედებისა და ქვეყნის ინტერესების სამართლებრივი მხარდაჭერის მიზნით სახელმწიფო პოლიტიკის შემუშავება და მართვა, მათ შორის, სისხლის სამართლის სისტემის რეფორმის განხორციელება","სამართალშემოქმედებისა და ქვეყნის ინტერესების სამართლებრივი მხარდაჭერის მიზნით სახელმწიფო პოლიტიკის შემუშავება და მართვა, მათ შორის, სისხლის სამართლის სისტემის რეფორმის განხორციელება",false
26 02,program,გამოძიებაზე ზედამხედველობის სახელმწიფო ბრალდების მხარდაჭერის დანაშაულის წინააღმდეგ ბრძოლისა და პრევენციის პროგრამა,გამოძიებაზე ზედამხედველობის სახელმწიფო ბრალდების მხარდაჭერის დანაშაულის წინააღმდეგ ბრძოლისა და პრევენციის პროგრამა,"გამოძიებაზე ზედამხედველობის, სახელმწიფო ბრალდების მხარდაჭერის, დანაშაულის წინააღმდეგ ბრძოლისა და პრევენციის პროგრამა","გამოძიებაზე ზედამხედველობის, სახელმწიფო ბრალდების მხარდაჭერის, დანაშაულის წინააღმდეგ ბრძოლისა და პრევენციის პროგრამა","გამოძიებაზე ზედამხედველობის, სახელმწიფო ბრალდების მხარდაჭერის, დანაშაულის წინააღმდეგ ბრძოლისა და პრევენციის პროგრამა",false
26 03,program,ეროვნული საარქივო ფონდის დაცულობის მომსახურების თანამედროვე ტექნოლოგიების დანერგვის და დოკუმენტების ხელმისაწვდომობის უზრუნველყოფა,ეროვნული საარქივო ფონდის დაცულობის მომსახურების თანამედროვე ტექნოლოგიების დანერგვის და დოკუმენტების ხელმისაწვდომობის უზრუნველყოფა,"ეროვნული საარქივო ფონდის დაცულობის, მომსახურების თანამედროვე ტექნოლოგიების დანერგვის და დოკუმენტების ხელმისაწვდომობის უზრუნველყოფა","ეროვნული საარქივო ფონდის დაცულობის, მომსახურების თანამედროვე ტექნოლოგიების დანერგვის და დოკუმენტების ხელმისაწვდომობის უზრუნველყოფა","ეროვნული საარქივო ფონდის დაცულობის, მომსახურების თანამედროვე ტექნოლოგიების დანერგვის და დოკუმენტების ხელმისაწვდომობის უზრუნველყოფა",false
26 04,program,იუსტიციის სამინისტროს სისტემის თანამშრომელთა გადამზადება და სასწავლო ცენტრის განვითარება,იუსტიციის სამინისტროს სისტემის თანამშრომელთა გადამზადება და სასწავლო ცენტრის განვითარება,იუსტიციის სამინისტროს სისტემის თანამშრომელთა გადამზადება და სასწავლო ცენტრის განვითარება,იუსტიციის სამინისტროს სისტემის თანამშრომელთა გადამზადება და სასწავლო ცენტრის განვითარება,საქართველოს იუსტიციის სამინისტროს სისტემის თანამშრომელთა გადამზადება და სასწავლო ცენტრის განვითარება,false
26 05,program,ელექტრონული მმართველობის განვითარება,ელექტრონული მმართველობის განვითარება,ელექტრონული მმართველობის განვითარება,ელექტრონული მმართველობის განვითარება,ელექტრონული მმართველობის განვითარება,true
26 06,program,იუსტიციის სახლების ფარგლებში მომსახურებათა ეფექტიანი წარმოება და ყველა დაინტერესებული პირისათვის ხელმისაწვდომობა,იუსტიციის სახლების ფარგლებში მომსახურებათა ეფექტიანი წარმოება და ყველა დაინტერესებული პირისათვის ხელმისაწვდომობა,ერთიანი სახელმწიფო საინფორმაციო ტექნოლოგიების მხარდაჭერის განვითარება,ერთიანი სახელმწიფო საინფორმაციო ტექნოლოგიების მხარდაჭერის განვითარება,ერთიანი სახელმწიფო საინფორმაციო ტექნოლოგიების მხარდაჭერის განვითარება,false
26 07,program,,ერთიანი სახელმწიფო საინფორმაციო ტექნოლოგიების მხარდაჭერის განვითარება,დანაშაულის პრევენცია და ინოვაციური პროგრამები,დანაშაულის პრევენცია და ინოვაციური პროგრამები,დანაშაულის პრევენცია და ინოვაციური პროგრამები,false
26 08,program,ერთიანი სახელმწიფო საინფორმაციო ტექნოლოგიების მხარდაჭერის განვითარება,დანაშაულის პრევენცია და ინოვაციური პროგრამები,სახელმწიფო სერვისების განვითარების სააგენტოს მომსახურებათა განვითარება და ხელმისაწვდომობა,სახელმწიფო სერვისების განვითარების სააგენტოს მომსახურებათა განვითარება და ხელმისაწვდომობა,სახელმწიფო სერვისების განვითარების სააგენტოს მომსახურებათა განვითარება და ხელმისაწვდომობა,false
26 09,program,ტურისტული საინვესტიციო და ინფრასტრუქტურული პროექტების კოორდინაცია და მონიტორინგი,,საჯარო რეესტრის ეროვნული სააგენტოს მომსახურებათა განვითარება და ხელმისაწვდომობა,იუსტიციის სახლის მომსახურებათა განვითარება და ხელმისაწვდომობა,მიწის ბაზრის განვითარება (WB),false
26 10,program,,,იუსტიციის სახლის მომსახურებათა განვითარება და ხელმისაწვდომობა,ნორმატიული აქტების სისტემატიზაცია და მთარგმნელობითი ცენტრის განვითარება,იუსტიციის სახლის მომსახურებათა განვითარება და ხელმისაწვდომობა,false
26 12,program,,,,,საჯარო რეესტრის ეროვნული სააგენტოს მომსახურებათა განვითარება და ხელმისაწვდომობა,true
26 14,program,,,,მიწის ბაზრის განვითარება (WB),,true
27 00,spending agency,საქართველოს სასჯელაღსრულების პრობაციისა და იურიდიული დახმარების საკითხთა სამინისტრო,საქართველოს სასჯელაღსრულების პრობაციისა და იურიდიული დახმარების საკითხთა სამინისტრო,"საქართველოს სასჯელაღსრულების, პრობაციისა და იურიდიული დახმარების საკითხთა სამინისტრო",საქართველოს სასჯელაღსრულებისა და პრობაციის სამინისტრო,საქართველოს სასჯელაღსრულებისა და პრობაციის სამინისტრო,false
27 01,program,პენიტენციური სისტემის პოლიტიკის შემუშავება და მართვა,პენიტენციური სისტემის პოლიტიკის შემუშავება და მართვა,პენიტენციური სისტემის პოლიტიკის შემუშავება და მართვა,პენიტენციური სისტემის პოლიტიკის შემუშავება და მართვა,საერთაშორისო სტანდარტების შესაბამისი პენიტენციური სისტემის ჩამოყალიბება,false
27 01 01,sub-program,,,,,"პენიტენციური სისტემის პოლიტიკის შემუშავება, მართვა და ბრალდებულ/მსჯავრდებულთა ყოფითი პირობების გაუმჯობესება",true
27 01 02,sub-program,,,,,ბრალდებულთა და მსჯავრდებულთა ეკვივალენტური სამედიცინო მომსახურებით უზრუნველყოფა,true
