41 01,program,,,საქართველოს სახალხო დამცველის აპარატის ფუნქციონირების გაძლიერების ღონისძიებები (საქართველოს სახალხო დამცველის აპარატი,საქართველოს სახალხო დამცველის აპარატის ფუნქციონირების გაძლიერების ღონისძიებები (საქართველოს სახალხო დამცველის აპარატი,საქართველოს სახალხო დამცველის აპარატის ფუნქციონირების გაძლიერების ღონისძიებები (საქართველოს სახალხო დამცველის აპარატი,true
42 00,spending agency,სსიპ – საზოგადოებრივი მაუწყებელი,სსიპ - საზოგადოებრივი მაუწყებელი,სსიპ – საზოგადოებრივი მაუწყებელი,სსიპ – საზოგადოებრივი მაუწყებელი,სსიპ – საზოგადოებრივი მაუწყებელი,false
42 01,program,,,მაუწყებლობის ხელშეწყობა,მაუწყებლობის ხელშეწყობა,მაუწყებლობის ხელშეწყობა,true
43 00,spending agency,სსიპ – კონკურენციისა და სახელმწიფო შესყიდვების სააგენტო,სსიპ - კონკურენციისა და სახელმწიფო შესყიდვების სააგენტო,სსიპ – კონკურენციისა და სახელმწიფო შესყიდვების სააგენტო,სსიპ – კონკურენციის სააგენტო,სსიპ – კონკურენციის სააგენტო,false
43 01,program,სსიპ კონკურენციისა და სახელმწიფო შესყიდვების სააგენტო,სსიპ კონკურენციისა და სახელმწიფო შესყიდვების სააგენტო,სსიპ - კონკურენციისა და სახელმწიფო შესყიდვების სააგენტო,,,false
43 02,program,სახელმწიფო სექტორის ფინანსური მართვის მხარდაჭერის პროექტი (WB–SIDA–ნიდერლანდი– DFID),,,,,true
44 00,spending agency,სამხრეთ ოსეთის ადმინისტრაცია,სამხრეთ ოსეთის ადმინისტრაცია,სამხრეთ ოსეთის ადმინისტრაცია,სამხრეთ ოსეთის ადმინისტრაცია,ყოფილი სამხრეთ ოსეთის ავტონომიური ოლქის ტერიტორიაზე დროებითი ადმინისტრაციულ-ტერიტორიული ერთეულის ადმინისტრაცია - სამხრეთ ოსეთის ადმინისტრაცია,false
45 00,spending agency,საქართველოს საპატრიარქო,საქართველოს საპატრიარქო,საქართველოს საპატრიარქო,საქართველოს საპატრიარქო,საქართველოს საპატრიარქო,true
45 01,program,სასულიერო განათლების ხელშეწყობის გრანტი,სასულიერო განათლების ხელშეწყობის გრანტი,სასულიერო განათლების ხელშეწყობის გრანტი,სასულიერო განათლების ხელშეწყობის გრანტი,სასულიერო განათლების ხელშეწყობის გრანტი,true
45 02,program,საქართველოს საპატრიარქოს წმინდა სიმონ კანანელის სახელობის სასულიერო სწავლების ცენტრისათვის გადასაცემი გრანტი,საქართველოს საპატრიარქოს წმინდა სიმონ კანანელის სახელობის სასულიერო სწავლების ცენტრისათვის გადასაცემი გრანტი,ა(ა)იპ საქართველოს საპატრიარქოს წმიდა სვიმონ კანანელის სახელობის სასულიერო სწავლების ცენტრი,ა(ა)იპ საქართველოს საპატრიარქოს წმიდა სვიმონ კანანელის სახელობის სასულიერო სწავლების ცენტრი,ა(ა)იპ საქართველოს საპატრიარქოს წმიდა სვიმონ კანანელის სახელობის სასულიერო სწავლების ცენტრი,false
45 03,program,ა ა იპ – ბათუმისა და ლაზეთის ეპარქიის საგანმანათლებლო ცენტრისათვის გადასაცემი გრანტი,ა ა იპ - ბათუმისა და ლაზეთის ეპარქიის საგანმანათლებლო ცენტრისათვის გადასაცემი გრანტი,ა(ა)იპ – ბათუმისა და ლაზეთის ეპარქიის საგანმანათლებლო ცენტრისათვის გადასაცემი გრანტი,ა(ა)იპ – ბათუმისა და ლაზეთის ეპარქიის საგანმანათლებლო ცენტრისათვის გადასაცემი გრანტი,ა(ა)იპ – ბათუმისა და ლაზეთის ეპარქიის საგანმანათლებლო ცენტრისათვის გადასაცემი გრანტი,false
45 04,program,საქართველოს საპატრიარქოს წმიდა ნინოს სახელობის ობოლ უპატრონო და მზრუნველობამოკლებულ ბავშვთა პანსიონატისათვის გადასაცემი გრანტი,საქართველოს საპატრიარქოს წმიდა ნინოს სახელობის ობოლ უპატრონო და მზრუნველობამოკლებულ ბავშვთა პანსიონატისათვის გადასაცემი გრანტი,"საქართველოს საპატრიარქოს წმიდა ნინოს სახელობის ობოლ, უპატრონო და მზრუნველობამოკლებულ ბავშვთა პანსიონატისათვის გადასაცემი გრანტი","საქართველოს საპატრიარქოს წმიდა ნინოს სახელობის ობოლ, უპატრონო და მზრუნველობამოკლებულ ბავშვთა პანსიონატისათვის გადასაცემი გრანტი","საქართველოს საპატრიარქოს წმიდა ნინოს სახელობის ობოლ, უპატრონო და მზრუნველობამოკლებულ ბავშვთა პანსიონატისათვის გადასაცემი გრანტი",false
45 05,program,საქართველოს საპატრიარქოს ბათუმის წმინდა მოწამე ეკატერინეს სახელობის სათნოების სავანისათვის გადასაცემი გრანტი,საქართველოს საპატრიარქოს ბათუმის წმინდა მოწამე ეკატერინეს სახელობის სათნოების სავანისათვის გადასაცემი გრანტი,საქართველოს საპატრიარქოს ბათუმის წმინდა მოწამე ეკატერინეს სახელობის სათნოების სავანისათვის გადასაცემი გრანტი,საქართველოს საპატრიარქოს ბათუმის წმინდა მოწამე ეკატერინეს სახელობის სათნოების სავანისათვის გადასაცემი გრანტი,საქართველოს საპატრიარქოს ბათუმის წმინდა მოწამე ეკატერინეს სახელობის სათნოების სავანისათვის გადასაცემი გრანტი,true
45 06,program,საქართველოს საპატრიარქოს წმინდა ანდრია პირველწოდებულის სახელობის სასულიერო სწავლების ცენტრისათვის გადასაცემი გრანტი,საქართველოს საპატრიარქოს წმინდა ანდრია პირველწოდებულის სახელობის სასულიერო სწავლების ცენტრისათვის გადასაცემი გრანტი,საქართველოს საპატრიარქოს წმინდა ანდრია პირველწოდებულის სახელობის სასულიერო სწავლების ცენტრისათვის გადასაცემი გრანტი,საქართველოს საპატრიარქოს წმინდა ანდრია პირველწოდებულის სახელობის სასულიერო სწავლების ცენტრისათვის გადასაცემი გრანტი,საქართველოს საპატრიარქოს წმინდა ანდრია პირველწოდებულის სახელობის სასულიერო სწავლების ცენტრისათვის გადასაცემი გრანტი,true
45 07,program,წმინდა გიორგი მთაწმინდელის მონასტერთან არსებული სარეაბილიტაციო ცენტრისათვის გადასაცემი გრანტი,წმინდა გიორგი მთაწმინდელის მონასტერთან არსებული სარეაბილიტაციო ცენტრისათვის გადასაცემი გრანტი,წმინდა გიორგი მთაწმინდელის მონასტერთან არსებული სარეაბილიტაციო ცენტრისათვის გადასაცემი გრანტი,წმინდა გიორგი მთაწმინდელის მონასტერთან არსებული სარეაბილიტაციო ცენტრისათვის გადასაცემი გრანტი,წმინდა გიორგი მთაწმინდელის მონასტერთან არსებული სარეაბილიტაციო ცენტრისათვის გადასაცემი გრანტი,true
45 08,program,საქართველოს საპატრიარქოს წმინდა ანდრია პირველწოდებულის სახელობის ქართული უნივერსიტეტისათვის გადასაცემი გრანტი,საქართველოს საპატრიარქოს წმინდა ანდრია პირველწოდებულის სახელობის ქართული უნივერსიტეტისათვის გადასაცემი გრანტი,საქართველოს საპატრიარქოს წმინდა ანდრია პირველწოდებულის სახელობის ქართული უნივერსიტეტისათვის გადასაცემი გრანტი,საქართველოს საპატრიარქოს წმინდა ანდრია პირველწოდებულის სახელობის ქართული უნივერსიტეტისათვის გადასაცემი გრანტი,საქართველოს საპატრიარქოს წმინდა ანდრია პირველწოდებულის სახელობის ქართული უნივერსიტეტისათვის გადასაცემი გრანტი,true
45 09,program,საქართველოს საპატრიარქოს ა ა იპ – ტბელ აბუსერისძის სახელობის უნივერსიტეტისათვის გადასაცემი გრანტი,საქართველოს საპატრიარქოს ა ა იპ - ტბელ აბუსერისძის სახელობის უნივერსიტეტისათვის გადასაცემი გრანტი,საქართველოს საპატრიარქოს ა(ა)იპ – ტბელ აბუსერისძის სახელობის უნივერსიტეტისათვის გადასაცემი გრანტი,საქართველოს საპატრიარქოს ა(ა)იპ – ტბელ აბუსერისძის სახელობის უნივერსიტეტისათვის გადასაცემი გრანტი,საქართველოს საპატრიარქოს ა(ა)იპ – ტბელ აბუსერისძის სახელობის უნივერსიტეტისათვის გადასაცემი გრანტი,false
45 10,program,ა ა იპ – სმენადაქვეითებულ ბავშვთა რეაბილიტაციის და ადაპტაციის ცენტრისათვის გადასაცემი გრანტი,ა ა იპ - სმენადაქვეითებულ ბავშვთა რეაბილიტაციის და ადაპტაციის ცენტრისათვის გადასაცემი გრანტი,ა(ა)იპ – სმენადაქვეითებულ ბავშვთა რეაბილიტაციის და ადაპტაციის ცენტრისათვის გადასაცემი გრანტი,ა(ა)იპ – სმენადაქვეითებულ ბავშვთა რეაბილიტაციის და ადაპტაციის ცენტრისათვის გადასაცემი გრანტი,ა(ა)იპ – სმენადაქვეითებულ ბავშვთა რეაბილიტაციის და ადაპტაციის ცენტრისათვის გადასაცემი გრანტი,false
45 11,program,საქართველოს საპატრიარქოს ტელევიზიის სუბსიდირების ღონისძიებები,საქართველოს საპატრიარქოს ტელევიზიის სუბსიდირების ღონისძიებები,საქართველოს საპატრიარქოს ტელევიზიის სუბსიდირების ღონისძიებები,საქართველოს საპატრიარქოს ტელევიზიის სუბსიდირების ღონისძიებები,საქართველოს საპატრიარქოს ტელევიზიის სუბსიდირების ღონისძიებები,true
45 12,program,ა ა იპ – ახალქალაქისა და კუმურდოს ეპარქიის სასწავლო ცენტრისთვის გადასაცემი გრანტი,ა ა იპ - ახალქალაქისა და კუმურდოს ეპარქიის სასწავლო ცენტრისთვის გადასაცემი გრანტი,ა(ა)იპ – ახალქალაქისა და კუმურდოს ეპარქიის სასწავლო ცენტრისთვის გადასაცემი გრანტი,ა(ა)იპ – ახალქალაქისა და კუმურდოს ეპარქიის სასწავლო ცენტრისთვის გადასაცემი გრანტი,ა(ა)იპ – ახალქალაქისა და კუმურდოს ეპარქიის სასწავლო ცენტრისთვის გადასაცემი გრანტი,false
45 13,program,,ა ა იპ ფოთის საგანმანათლებლო და კულტურულ გამაჯანსაღებელი ცენტრი,ა(ა)იპ ფოთის საგანმანათლებლო და კულტურულ-გამაჯანსაღებელი ცენტრი,ა(ა)იპ ფოთის საგანმანათლებლო და კულტურულ-გამაჯანსაღებელი ცენტრი,ა(ა)იპ ფოთის საგანმანათლებლო და კულტურულ-გამაჯანსაღებელი ცენტრი,false
46 00,spending agency,სსიპ – ლევან სამხარაულის სახელობის სასამართლო ექსპერტიზის ეროვნული ბიურო,სსიპ - ლევან სამხარაულის სახელობის სასამართლო ექსპერტიზის ეროვნული ბიურო,სსიპ – ლევან სამხარაულის სახელობის სასამართლო ექსპერტიზის ეროვნული ბიურო,სსიპ – ლევან სამხარაულის სახელობის სასამართლო ექსპერტიზის ეროვნული ბიურო,სსიპ – ლევან სამხარაულის სახელობის სასამართლო ექსპერტიზის ეროვნული ბიურო,false
47 00,spending agency,სსიპ – საქართველოს სტატისტიკის ეროვნული სამსახური – საქსტატი,სსიპ - საქართველოს სტატისტიკის ეროვნული სამსახური - საქსტატი,სსიპ – საქართველოს სტატისტიკის ეროვნული სამსახური – საქსტატი,სსიპ – საქართველოს სტატისტიკის ეროვნული სამსახური – საქსტატი,სსიპ – საქართველოს სტატისტიკის ეროვნული სამსახური – საქსტატი,false
47 01,program,სტატისტიკური სამუშაოების დაგეგმვა და მართვა,სტატისტიკური სამუშაოების დაგეგმვა და მართვა,სტატისტიკური სამუშაოების დაგეგმვა და მართვა,სტატისტიკური სამუშაოების დაგეგმვა და მართვა,სტატისტიკური სამუშაოების დაგეგმვა და მართვა,true
47 02,program,სტატისტიკური სამუშაოების სახელმწიფო პროგრამა,სტატისტიკური სამუშაოების სახელმწიფო პროგრამა,სტატისტიკური სამუშაოების სახელმწიფო პროგრამა,სტატისტიკური სამუშაოების სახელმწიფო პროგრამა,სტატისტიკური სამუშაოების სახელმწიფო პროგრამა,true
47 03,program,მოსახლეობისა და საცხოვრისების საყოველთაო აღწერა,მოსახლეობისა და საცხოვრისების საყოველთაო აღწერა,მოსახლეობისა და საცხოვრისების საყოველთაო აღწერა,მოსახლეობისა და საცხოვრისების საყოველთაო აღწერა,მოსახლეობისა და საცხოვრისების საყოველთაო აღწერა,true
47 04,program,შინამეურნეობების ინტეგრირებული კვლევის პროგრამა,შინამეურნეობების ინტეგრირებული კვლევის პროგრამა,,,,true
47 05,program,სასოფლო მეურნეობების შერჩევითი კვლევის პროგრამა,სასოფლო მეურნეობების შერჩევითი კვლევის პროგრამა,,,,true
