33 00,spending agency,საქართველოს კულტურისა და ძეგლთა დაცვის სამინისტრო,საქართველოს კულტურისა და ძეგლთა დაცვის სამინისტრო,საქართველოს კულტურისა და ძეგლთა დაცვის სამინისტრო,საქართველოს კულტურისა და ძეგლთა დაცვის სამინისტრო,საქართველოს კულტურისა და ძეგლთა დაცვის სამინისტრო,true
33 01,program,საქართველოს კულტურისა და ძეგლთა დაცვის სფეროში პოლიტიკის შემუშავება და პროგრამების მართვა,საქართველოს კულტურისა და ძეგლთა დაცვის სფეროში პოლიტიკის შემუშავება და პროგრამების მართვა,საქართველოს კულტურისა და ძეგლთა დაცვის სფეროში პოლიტიკის შემუშავება და პროგრამების მართვა,საქართველოს კულტურისა და ძეგლთა დაცვის სფეროში პოლიტიკის შემუშავება და პროგრამების მართვა,კულტურისა და ძეგლთა დაცვის სფეროში პოლიტიკის შემუშავება და პროგრამების მართვა,false
33 02,program,ხელოვნების დარგების განვითარების ხელშეწყობა და პოპულარიზაცია საქართველოში და მისი ფარგლებს გარეთ,ხელოვნების დარგების განვითარების ხელშეწყობა და პოპულარიზაცია საქართველოში და მის ფარგლებს გარეთ,ხელოვნების დარგების განვითარების ხელშეწყობა და პოპულარიზაცია საქართველოში და მის ფარგლებს გარეთ,ხელოვნების დარგების განვითარების ხელშეწყობა და პოპულარიზაცია საქართველოში და მის ფარგლებს გარეთ,ხელოვნების დარგების განვითარების ხელშეწყობა და პოპულარიზაცია საქართველოში და მის ფარგლებს გარეთ,false
33 02 01,sub-program,ხელოვნების განვითარების ღონისძიებები,ხელოვნების განვითარების ღონისძიებები,,,,true
33 02 02,sub-program,საერთაშორისო კულტურული ურთიერთობების მხარდაჭერის ღონისძიებები,საერთაშორისო კულტურული ურთიერთობების მხარდაჭერის ღონისძიებები,,,,true
33 02 03,sub-program,სახალხო არტისტების სახალხო მხატვრებისა და ლაურეატების სტიპენდიები,სახალხო არტისტების სახალხო მხატვრებისა და ლაურეატების სტიპენდიები,,,,true
33 03,program,სახელოვნებო განათლების სისტემის ხელშეწყობა,სახელოვნებო განათლების სისტემის ხელშეწყობა,სახელოვნებო განათლების სისტემის ხელშეწყობა,სახელოვნებო განათლების სისტემის ხელშეწყობა,სახელოვნებო განათლების სისტემის ხელშეწყობა,true
33 04,program,კულტურული მემკვიდრეობის დაცვა და სამუზეუმო სისტემის სრულყოფა,კულტურული მემკვიდრეობის დაცვა და სამუზეუმო სისტემის სრულყოფა,კულტურული მემკვიდრეობის დაცვა და სამუზეუმო სისტემის სრულყოფა,კულტურული მემკვიდრეობის დაცვა და სამუზეუმო სისტემის სრულყოფა,კულტურული მემკვიდრეობის დაცვა და სამუზეუმო სისტემის სრულყოფა,true
33 04 01,sub-program,მუზეუმების ხელშეწყობა,მუზეუმების ხელშეწყობა,მუზეუმების ხელშეწყობა,მუზეუმების ხელშეწყობა,მუზეუმების ხელშეწყობა,true
33 04 02,sub-program,კულტურული მემკვიდრეობის დაცვა,კულტურული მემკვიდრეობის დაცვა,კულტურული მემკვიდრეობის დაცვა,კულტურული მემკვიდრეობის დაცვა,კულტურული მემკვიდრეობის დაცვა,true
33 05,program,,კულტურის სფეროს მდგრადობის უზრუნველყოფის და ფინანსური ძლიერების პროგრამა,კულტურის სფეროს მდგრადობის უზრუნველყოფის და ფინანსური ძლიერების პროგრამა,,,true
33 05 01,sub-program,,კულტურის სფეროს ფინანსური გაძლიერების პროგრამა,კულტურის სფეროს ფინანსური გაძლიერების პროგრამა,,,true
33 05 02,sub-program,,კულტურის სფეროს მდგრადობის უზრუნველყოფის საინვესტიციო ფონდი,კულტურის სფეროს მდგრადობის უზრუნველყოფის საინვესტიციო ფონდი,,,true
34 00,spending agency,საქართველოს ოკუპირებული ტერიტორიებიდან იძულებით გადაადგილებულ პირთა განსახლებისა და ლტოლვილთა სამინისტრო,საქართველოს ოკუპირებული ტერიტორიებიდან იძულებით გადაადგილებულ პირთა განსახლებისა და ლტოლვილთა სამინისტრო,"საქართველოს ოკუპირებული ტერიტორიებიდან იძულებით  გადაადგილებულ პირთა, განსახლებისა და ლტოლვილთა სამინისტრო","საქართველოს ოკუპირებული ტერიტორიებიდან იძულებით  გადაადგილებულ პირთა, განსახლებისა და ლტოლვილთა სამინისტრო","საქართველოს ოკუპირებული ტერიტორიებიდან იძულებით  გადაადგილებულ პირთა, განსახლებისა და ლტოლვილთა სამინისტრო",false
34 01,program,იძულებით გადაადგილებულ პირთა და მიგრანტთა ხელშეწყობის მიზნით სახელმწიფო პოლიტიკის შემუშავება და პროგრამების მართვა,იძულებით გადაადგილებულ პირთა და მიგრანტთა ხელშეწყობის მიზნით სახელმწიფო პოლიტიკის შემუშავება და პროგრამების მართვა,იძულებით გადაადგილებულ პირთა და მიგრანტთა ხელშეწყობის მიზნით სახელმწიფო პოლიტიკის შემუშავება და პროგრამების მართვა,იძულებით გადაადგილებულ პირთა და მიგრანტთა ხელშეწყობის მიზნით სახელმწიფო პოლიტიკის შემუშავება და პროგრამების მართვა,იძულებით გადაადგილებულ პირთა და მიგრანტთა ხელშეწყობის მიზნით სახელმწიფო პოლიტიკის შემუშავება და პროგრამების მართვა,true
34 02,program,განსახლების ადგილებში დევნილთა შენახვა და მათი საცხოვრებელი პირობების გაუმჯობესება,განსახლების ადგილებში დევნილთა შენახვა და მათი საცხოვრებელი პირობების გაუმჯობესება,განსახლების ადგილებში დევნილთა შენახვა და მათი საცხოვრებელი პირობების გაუმჯობესება,განსახლების ადგილებში დევნილთა შენახვა და მათი საცხოვრებელი პირობების გაუმჯობესება,განსახლების ადგილებში დევნილთა შენახვა და მათი საცხოვრებელი პირობების გაუმჯობესება,true
34 03,program,,,,დევნილთა საარსებო წყაროებით უზრუნველყოფა,დევნილთა საარსებო წყაროებით უზრუნველყოფა,true
35 00,spending agency,საქართველოს შრომის ჯანმრთელობისა და სოციალური დაცვის სამინისტრო,საქართველოს შრომის ჯანმრთელობისა და სოციალური დაცვის სამინისტრო,"საქართველოს შრომის, ჯანმრთელობისა და სოციალური დაცვის სამინისტრო","საქართველოს შრომის, ჯანმრთელობისა და სოციალური დაცვის სამინისტრო","საქართველოს შრომის, ჯანმრთელობისა და სოციალური დაცვის სამინისტრო",false
35 01,program,შრომის ჯანმრთელობისა და სოციალური დაცვის პროგრამების მართვა,შრომის ჯანმრთელობისა და სოციალური დაცვის პროგრამების მართვა,"შრომის, ჯანმრთელობისა და სოციალური დაცვის პროგრამების მართვა","შრომის, ჯანმრთელობისა და სოციალური დაცვის პროგრამების მართვა","შრომის, ჯანმრთელობისა და სოციალური დაცვის პროგრამების მართვა",false
35 01 01,sub-program,შრომის ჯანმრთელობისა და სოციალური დაცვის სფეროში პოლიტიკის შემუშავება და მართვა,შრომის ჯანმრთელობისა და სოციალური დაცვის სფეროში პოლიტიკის შემუშავება და მართვა,"შრომის, ჯანმრთელობისა და სოციალური დაცვის სფეროში პოლიტიკის შემუშავება და მართვა","შრომის, ჯანმრთელობისა და სოციალური დაცვის სფეროში პოლიტიკის შემუშავება და მართვა","შრომის, ჯანმრთელობისა და სოციალური დაცვის სფეროში პოლიტიკის შემუშავება და მართვა",false
35 01 02,sub-program,სამედიცინო საქმიანობის რეგულირების პროგრამა,სამედიცინო საქმიანობის რეგულირების პროგრამა,სამედიცინო საქმიანობის რეგულირების პროგრამა,სამედიცინო საქმიანობის რეგულირების პროგრამა,სამედიცინო საქმიანობის რეგულირების პროგრამა,true
35 01 03,sub-program,დაავადებათა კონტროლისა და ეპიდემიოლოგიური უსაფრთხოების პროგრამის მართვა,დაავადებათა კონტროლისა და ეპიდემიოლოგიური უსაფრთხოების პროგრამის მართვა,დაავადებათა კონტროლისა და ეპიდემიოლოგიური უსაფრთხოების პროგრამის მართვა,დაავადებათა კონტროლისა და ეპიდემიოლოგიური უსაფრთხოების პროგრამის მართვა,დაავადებათა კონტროლისა და ეპიდემიოლოგიური უსაფრთხოების პროგრამის მართვა,true
35 01 04,sub-program,სოციალური და ჯანმრთელობის დაცვის პროგრამების მართვა,სოციალური და ჯანმრთელობის დაცვის პროგრამების მართვა,სოციალური და ჯანმრთელობის დაცვის პროგრამების მართვა,სოციალური და ჯანმრთელობის დაცვის პროგრამების მართვა,სოციალური და ჯანმრთელობის დაცვის პროგრამების მართვა,true
35 01 05,sub-program,სახელმწიფო ზრუნვის პროგრამა,სახელმწიფო ზრუნვის ადამიანით ვაჭრობის ტრეფიკინგის მსხვერპლთა დაცვა და დახმარების პროგრამა,"სახელმწიფო ზრუნვის, ადამიანით ვაჭრობის (ტრეფიკინგის) მსხვერპლთა დაცვა და დახმარების პროგრამა","სახელმწიფო ზრუნვის, ადამიანით ვაჭრობის (ტრეფიკინგის) მსხვერპლთა დაცვა და დახმარების პროგრამა","სახელმწიფო ზრუნვის, ადამიანით ვაჭრობის (ტრეფიკინგის) მსხვერპლთა დაცვა და დახმარების პროგრამა",false
35 01 06,sub-program,ადამიანით ვაჭრობის ტრეფიკინგის მსხვერპლთა დაცვა და დახმარება,სამედიცინო მედიაციის პროგრამა,სამედიცინო მედიაციის პროგრამა,სამედიცინო მედიაციის პროგრამა,სასწრაფო სამედიცინო დახმარების მართვის პროგრამა,false
35 01 07,sub-program,,ნარკომანიით დაავადებულ პირთა რეაბილიტაციის ხელშეწყობის პროგრამა,ნარკომანიით დაავადებულ პირთა რეაბილიტაციის ხელშეწყობის პროგრამა,ნარკომანიისა და ფსიქიკური ჯანმრთელობის პოლიტიკისა და პროგრამების მართვის პროგრამა,,false
35 01 08,sub-program,,,სასწრაფო სამედიცინო დახმარების პროგრამა,სასწრაფო სამედიცინო დახმარების მართვის პროგრამა,,false
35 01 12,sub-program,ნარკომანიით დაავადებულ პირთა რეაბილიტაციის ხელშეწყობის პროგრამის მართვა,,,,,true
35 02,program,სოციალური დაცვა და საპენსიო უზრუნველყოფა,სოციალური დაცვა და საპენსიო უზრუნველყოფა,სოციალური დაცვა და საპენსიო უზრუნველყოფა,სოციალური დაცვა და საპენსიო უზრუნველყოფა,მოსახლეობის სოციალური დაცვა,false
35 02 01,sub-program,საპენსიო უზრუნველყოფა,საპენსიო უზრუნველყოფა,საპენსიო უზრუნველყოფა,საპენსიო უზრუნველყოფა,მოსახლეობის საპენსიო უზრუნველყოფა,false
35 02 02,sub-program,სოციალური დახმარებები,სოციალური დახმარებები,სოციალური დახმარებები,სოციალური დახმარებები,მოსახლეობის მიზნობრივი ჯგუფების სოციალური დახმარება,false
35 02 03,sub-program,სოციალური რეაბილიტაცია და ბავშვზე ზრუნვა,სოციალური რეაბილიტაცია და ბავშვზე ზრუნვა,სოციალური რეაბილიტაცია და ბავშვზე ზრუნვა,სოციალური რეაბილიტაცია და ბავშვზე ზრუნვა,სოციალური რეაბილიტაცია და ბავშვზე ზრუნვა,true
35 02 04,sub-program,,,,,სოციალური შეღავათები მაღალმთიან დასახლებაში,true
35 02 05,sub-program,მოსახლეობის ელექტროენერგიის ვაუჩერით უზრუნველყოფა,,,,,true
35 03,program,ჯანმრთელობის დაცვის პროგრამა,ჯანმრთელობის დაცვის პროგრამა,ჯანმრთელობის დაცვის პროგრამა,ჯანმრთელობის დაცვის პროგრამა,მოსახლეობის ჯანმრთელობის დაცვა,false
35 03 01,sub-program,ჯანმრთელობის დაზღვევა,ჯანმრთელობის დაზღვევა,ჯანმრთელობის დაზღვევა,მოსახლეობის საყოველთაო ჯანმრთელობის დაცვა,მოსახლეობის საყოველთაო ჯანმრთელობის დაცვა,false
35 03 02,sub-program,საზოგადოებრივი ჯანმრთელობის დაცვა,საზოგადოებრივი ჯანმრთელობის დაცვა,მოსახლეობის საყოველთაო ჯანმრთელობის დაცვა,საზოგადოებრივი ჯანმრთელობის დაცვა,საზოგადოებრივი ჯანმრთელობის დაცვა,false
35 03 02 01,sub-sub-program,დაავადებათა ადრეული გამოვლენა და სკრინინგი,დაავადებათა ადრეული გამოვლენა და სკრინინგი,,დაავადებათა ადრეული გამოვლენა და სკრინინგი,დაავადებათა ადრეული გამოვლენა და სკრინინგი,true
35 03 02 02,sub-sub-program,იმუნიზაცია,იმუნიზაცია,,იმუნიზაცია,იმუნიზაცია,true
35 03 02 03,sub-sub-program,ეპიდზედამხედველობის პროგრამა,ეპიდზედამხედველობის პროგრამა,,ეპიდზედამხედველობის პროგრამა,ეპიდზედამხედველობა,false
35 03 02 04,sub-sub-program,უსაფრთხო სისხლი,უსაფრთხო სისხლი,,უსაფრთხო სისხლი,უსაფრთხო სისხლი,true
35 03 02 05,sub-sub-program,პროფესიულ დაავადებათა პრევენცია,პროფესიულ დაავადებათა პრევენცია,,პროფესიულ დაავადებათა პრევენცია,პროფესიულ დაავადებათა პრევენცია,true
